"When a stay-at-home dad who dedicates all his time to his children is persuaded to take time off for himself, he gets mixed up in the wild shenanigans of his childhood friend who's celebrating his 44th birthday."
"When a washed-up soap opera star meets a dancing beautician, zaniness ensues in Branson, Missouri."
"When a young boy vanishes, a small town uncovers a mystery involving secret experiments, terrifying supernatural forces and one strange little girl."
"When a young girl stows away on the ship of a legendary sea monster hunter, they launch an epic journey into uncharted waters - and make history to boot."
"When Alessandra and Emilio move to the city leaving their parents Carlo and Anna alone, life changes for everyone. In a few months the kids forget about their parents: a few phone calls, missed birthdays, missed funerals. But the ..."
"When alien invaders capture the Earth's superheroes, their kids must learn to work together to save their parents and the planet."
"When an army of powerful alien beings is unleashed on Earth threatening life as we know it, a brand-new team of Power Rangers, fueled by the prehistoric power of the dinosaurs, are recruited to deal with the threat."
"When an ex-cop returns to his home state of Florida to find a mobster's runaway girlfriend, what should've been a quick gig turns into a wild odyssey."
"When an outlaw discovers his enemy is being released from prison, he reunites his gang to seek revenge."
"When Enola Holmes (Sherlock's teen sister) discovers her mother is missing, she endeavours to find her, becoming a super-sleuth in her own right as she outwits her famous brother and unravels a dangerous conspiracy."
"When four women finally take the road trip they planned in high school, they have no idea of the things they'll bump into sometimes literally."
"When high school ends and adulthood begins, Benjamin and Joshua Israel, two Jewish identical twins , start feeling burdened and without a future. Joshua would like to have sex for the first time, while Benjamin chases the utopia o..."
"When Maudie, a ten-year-old puzzle prodigy, forms a detective agency with her classmates Ezra, Ava and Kyle, no crime is left unsolved."
"When Sahsu goes to Adana for a lecture, it's the perfect chance to face her estranged grandfather. But soon, she finds herself in the midst of a legend."
"When stuck in the afterlife, a girl is faced with the truth that God and the Devil both have ulterior motives."
"When the CIA's most skilled operative, whose true identity is known to none, accidentally uncovers dark agency secrets, a psychopathic former colleague puts a bounty on his head, setting off a global manhunt by international assas..."
"When the flood wave approaches the capital of Lower Silesia, a decision is made to save the city from the destructive elements, the surrounding villages and fields should be sacrificed."
"When the local mafia shows up to burn down her restaurant, Ana, a chef with a meticulous past, defends her turf and proves her knife skills both in and out of the kitchen."
"When the McKellan family moves from Seattle to Georgia to be closer to extended family, the transition is like being a catfish out of water."
"When the National Assembly suffers a catastrophic attack, Minister of Environment Park Mu Jin must find a way to lead Korea through the ensuing chaos."
"When three working-class teenagers begin attending an exclusive private school in Spain, the clash between them and the wealthy students leads to murder."
"When two Boston police officers are murdered, ex-cop Spenser teams up with his no-nonsense roommate Hawk to take down criminals."
"While fleeing from dangerous assailants, an assassin comes out of hiding to protect the daughter she left earlier in life."
"While navigating the troubled waters of romance, school and family, Archie and his gang become entangled in dark Riverdale mysteries."
"While visiting family in Mexico, teenage Alex gains an unlikely companion when he discovers a young chupacabra hiding in his grandpa's shed. To save the mythical creature, Alex and his cousins must embark on the adventure of a lif..."
"William falls in love with his soon-to-be daughter in law, Anna who's trying to keep both relationships but the truth always comes to light and someone is going to be hurt."
"With a little help from his brother and accomplice, Tim, Boss Baby tries to balance family life with his job at Baby Corp headquarters."
"Working as trauma cleaners, both Gu-ru and Sang-gu uncover various stories of the deceased while experiencing different emotions and sentiments toward life, death and family."
"Xinling Zheng was a care free rich girl until her mother was taken away from her by a car accident. Xinling was taken to treatment center for her depression. Strange things started to happen in the treatment center."
"Year 2003, Irene a young film student who is preparing a short film. To star in it, she meets Julio, with whom she quickly falls in love. But time and life take them down other paths, extending to the present."
"Young entrepreneurs aspiring to launch virtual dreams into reality compete for success and love in the cutthroat world of Korea's high-tech industry."
"Young, free and madly in love. As teenagers, the world was their oyster but as adults, their lives seem dimmer, like a very important piece is missing."
"Zeynep is unhappy. That's why she flees to a Croatian island, where her deceased mother bought a house long ago. She hopes to find peace and relaxation finally - but she hasn't reckoned with Josip, who still lives on the property."
